#tipo;frente;verso;contexto;tags
Basic;"[LOAS Art. 20 §1] Qual a expressao exata que a lei usa para definir onde os membros da familia do requerente do BPC devem viver?";"Sob o mesmo TETO";"Nao e 'domicilio', nem 'residencia', nem 'endereco'. A LOAS usa especificamente 'mesmo teto' — expressao coloquial que a Quadrix adora trocar. (Redacao dada pela Lei 12.435/2011)";loas,bpc
Basic;"[LOAS Art. 26-A] Os requisitos para concessao do Auxilio-Inclusao devem ser atendidos de que forma?";"Cumulativamente";"A lei diz 'cumulativamente' — todos ao mesmo tempo, sem excecao. Se a Quadrix trocar por 'alternativamente', a alternativa esta ERRADA. Art. 26-A, caput (Lei 14.176/2021)";loas,auxilio-inclusao
Basic;"[LOAS Art. 26-A] Quais sao os 4 incisos de requisitos cumulativos do Auxilio-Inclusao, na ordem?";"I - BPC + trabalho ate 2 sal. min. + RGPS; II - CadUnico; III - CPF; IV - criterios de manutencao do BPC";"Mnemonico: 'Trabalho > Cadastro > Documento > Manutencao'. I = atividade remunerada e previdencia, II = CadUnico atualizado, III = CPF regular, IV = manter criterios do BPC.";loas,auxilio-inclusao
Basic;"[LOAS Art. 26-A, III] O inciso III do Auxilio-Inclusao exige inscricao regular em qual documento?";"CPF";"Cuidado: RGPS aparece no inciso I (filiacao previdenciaria), CadUnico no inciso II. O inciso III e CPF — documento pessoal basico. Nao confunda os tres incisos.";loas,auxilio-inclusao
Permanence;"[LOAS Art. 20 §14] Por que o BPC de um idoso nao entra no calculo de renda para outro membro da mesma familia?";"Para evitar que familias com dois beneficiarios (idosos ou PcD) percam o direito ao segundo BPC";"Sem essa regra, o BPC do primeiro membro elevaria a renda per capita acima de 1/4 do sal. min., impedindo o segundo. Art. 20, §14 (Lei 13.982/2020).";loas,bpc
Cloze;"[Maria da Penha] O auxilio-aluguel concedido a ofendida tem periodo maximo de {{c1::6}} meses (Art. 23, VI)";"";"Incluido pela Lei 14.674/2023. Nao confundir com 12 meses — a protecao e emergencial, por isso o prazo e curto.";maria-da-penha,medidas-protetivas
Cloze;"[Maria da Penha] A violencia vicaria e violencia contra descendente, {{c1::ascendente}}, dependente, enteado, parente, pessoa sob guarda ou pessoa de sua {{c2::rede de apoio}}, com vistas a atingir a mulher (Art. 7, VI)";"";"Incluido pela Lei 15.384/2026. Nao e 'convivencia familiar' — e 'rede de apoio'. E 'ascendente' esta na lista, nao pode ser omitido.";maria-da-penha,violencia-vicaria
Basic;"[LOAS] Qual a diferenca entre a idade do Estatuto do Idoso e a idade exigida para o BPC?";"Estatuto do Idoso: 60 anos; BPC: 65 anos";"A LOAS Art. 20 exige 65 anos para o BPC, enquanto o Estatuto do Idoso (Lei 10.741/2003) define idoso como pessoa com 60 anos ou mais. A Quadrix troca os dois.";loas,bpc
